,id,text,text_compound,text_pos,text_neu,text_neg,text_sent,token_text
0,2022-04-14 20:51:48,Ethereum Burn Update Current Basefee 229 Gwei Avg Miner Tip138 Gwei Total burnt ETH 1546444 ETH Total burnt ETHUSD 61825361 httpstcoIjNPIjraWa,0.0,0.0,1.0,0.0,0,"['Ethereum', 'Burn', 'Update', 'Current', 'Basefee', '229', 'Gwei', 'Avg', 'Miner', 'Tip138', 'Gwei', 'Total', 'burnt', 'ETH', '1546444', 'ETH', 'Total', 'burnt', 'ETHUSD', '61825361', 'httpstcoIjNPIjraWa']"
1,2022-04-14 20:51:48,TheWeb3Finance Amazing great project Clockx24 UTK Ethereum Austin6077 MalikGCFR JayRikh ,0.836,0.497,0.503,0.0,1,"['TheWeb3Finance', 'Amazing', 'great', 'project', 'Clockx24', 'UTK', 'Ethereum', 'Austin6077', 'MalikGCFR', 'JayRikh']"
2,2022-04-14 20:51:48,RT DehootValley Hey Dehootians BIGGEST CROSSCHAIN COLLAB IS COMMING 24 projects joining bring biggest giveaway Wax,0.0,0.0,1.0,0.0,0,"['RT', 'DehootValley', 'Hey', 'Dehootians', 'BIGGEST', 'CROSSCHAIN', 'COLLAB', 'IS', 'COMMING', '24', 'project', 'joining', 'bring', 'biggest', 'giveaway', 'Wax']"
3,2022-04-14 20:51:47,TRACE TRACE altcoinnews BTC Ethereum nearNFTs NFTs NFTCommunity Metaverse BUDDY httpstcoy9TesjkcnO,0.0,0.0,1.0,0.0,0,"['TRACE', 'TRACE', 'altcoinnews', 'BTC', 'Ethereum', 'nearNFTs', 'NFTs', 'NFTCommunity', 'Metaverse', 'BUDDY', 'httpstcoy9TesjkcnO']"
4,2022-04-14 20:51:46,RT JohnGh87 Grove everywhere YAHOO FINANCE httpstco4JaJvAVZqt httpstcoirz8WhFdPk YahooFinance Yahoo NFTCommunity Metav,0.0,0.0,1.0,0.0,0,"['RT', 'JohnGh87', 'Grove', 'everywhere', 'YAHOO', 'FINANCE', 'httpstco4JaJvAVZqt', 'httpstcoirz8WhFdPk', 'YahooFinance', 'Yahoo', 'NFTCommunity', 'Metav']"
5,2022-04-14 20:51:46,RT SatoshiOwl  VIRAL  TheViralCrypto  SUPER EARLY GEM  100k MC  Liquidty 90k  DApp ready  Huge Marketing Contract,0.8567,0.42,0.58,0.0,1,"['RT', 'SatoshiOwl', 'VIRAL', 'TheViralCrypto', 'SUPER', 'EARLY', 'GEM', '100k', 'MC', 'Liquidty', '90k', 'DApp', 'ready', 'Huge', 'Marketing', 'Contract']"
6,2022-04-14 20:51:45,RT TekinogluDogu Yksek enflasyon beklentisinde piyasalarda nasl uzun vade plan izilir Acemi gibi hiper enflasyon mu beklenmeli,0.0,0.0,1.0,0.0,0,"['RT', 'TekinogluDogu', 'Yksek', 'enflasyon', 'beklentisinde', 'piyasalarda', 'nasl', 'uzun', 'vade', 'plan', 'izilir', 'Acemi', 'gibi', 'hiper', 'enflasyon', 'mu', 'beklenmeli']"
7,2022-04-14 20:51:45,RT VispXofficial VispX Ecosystem Explained Delivering innovation dual model launchpad powered high quality projects B,0.3818,0.167,0.833,0.0,1,"['RT', 'VispXofficial', 'VispX', 'Ecosystem', 'Explained', 'Delivering', 'innovation', 'dual', 'model', 'launchpad', 'powered', 'high', 'quality', 'project', 'B']"
8,2022-04-14 20:51:45, TimBeiko  Ethereum   httpstco5FBEh8yoKT,0.0,0.0,1.0,0.0,0,"['TimBeiko', 'Ethereum', 'httpstco5FBEh8yoKT']"
9,2022-04-14 20:51:45,RT DailyAvax1 AVAX Giveaway Follow DailyAvax Rt amp  amp Tag friends 48 Hours Avalanche BTC ETH Crypto NFTs NFT Giveaw,0.4767,0.14,0.86,0.0,1,"['RT', 'DailyAvax1', 'AVAX', 'Giveaway', 'Follow', 'DailyAvax', 'Rt', 'amp', 'amp', 'Tag', 'friend', '48', 'Hours', 'Avalanche', 'BTC', 'ETH', 'Crypto', 'NFTs', 'NFT', 'Giveaw']"
10,2022-04-14 20:51:45,RT Supersnailsnft  500000 GIVEAWAY FOR SUPERSNAILS NFT HOLDERS  Feast eyes BIGGEST MOST EPIC GIVEAWAY NFTGivea,0.0,0.0,1.0,0.0,0,"['RT', 'Supersnailsnft', '500000', 'GIVEAWAY', 'FOR', 'SUPERSNAILS', 'NFT', 'HOLDERS', 'Feast', 'eye', 'BIGGEST', 'MOST', 'EPIC', 'GIVEAWAY', 'NFTGivea']"
11,2022-04-14 20:51:44,RT blockvisionhq  Register us get rewards  300 6 lucky winners1 RT amp tag 3 friends 2 Join httpstcotQvEs7GFZG,0.8807,0.505,0.495,0.0,1,"['RT', 'blockvisionhq', 'Register', 'get', 'reward', '300', '6', 'lucky', 'winners1', 'RT', 'amp', 'tag', '3', 'friend', '2', 'Join', 'httpstcotQvEs7GFZG']"
12,2022-04-14 20:51:44, Atualizao cada hora 1 BTC  R19502794 1 ETH  R146197 1 ADA  R 41 1 XRP  R 344 1 DOGE  R 066 1 US  R 469 1 US Tur  R 492 bitcoin ethereum cardano ripplexrp dogecoin dollar,0.0,0.0,1.0,0.0,0,"['Atualizao', 'cada', 'hora', '1', 'BTC', 'R19502794', '1', 'ETH', 'R146197', '1', 'ADA', 'R', '41', '1', 'XRP', 'R', '344', '1', 'DOGE', 'R', '066', '1', 'US', 'R', '469', '1', 'US', 'Tur', 'R', '492', 'bitcoin', 'ethereum', 'cardano', 'ripplexrp', 'dogecoin', 'dollar']"
13,2022-04-14 20:51:44,VogelhausNFT AlanzhaNft This music project VogelhausNFT made TheRealKidSound steezyapegang It also grants WLspot upcoming generative collection Would cool could check  httpstcoO1l11Vl,0.4939,0.181,0.819,0.0,1,"['VogelhausNFT', 'AlanzhaNft', 'This', 'music', 'project', 'VogelhausNFT', 'made', 'TheRealKidSound', 'steezyapegang', 'It', 'also', 'grant', 'WLspot', 'upcoming', 'generative', 'collection', 'Would', 'cool', 'could', 'check', 'httpstcoO1l11Vl']"
14,2022-04-14 20:51:43,Twitter Look I found Salvator Mund collectible httpstcoZkg5jMIqoa rarible ethereum nonfungible digitalasset nft via rarible,0.0,0.0,1.0,0.0,0,"['Twitter', 'Look', 'I', 'found', 'Salvator', 'Mund', 'collectible', 'httpstcoZkg5jMIqoa', 'rarible', 'ethereum', 'nonfungible', 'digitalasset', 'nft', 'via', 'rarible']"
15,2022-04-14 20:51:42,RT RenaudHeitz Coup dur pour ethereum la mise  jour The Merge une nouvelle fois repousse  httpstcowXUN9CpS9e,0.0,0.0,1.0,0.0,0,"['RT', 'RenaudHeitz', 'Coup', 'dur', 'pour', 'ethereum', 'la', 'mise', 'jour', 'The', 'Merge', 'une', 'nouvelle', 'fois', 'repousse', 'httpstcowXUN9CpS9e']"
16,2022-04-14 20:51:41,No red candles SHIBA always Green gt BULLISH forever shiba shib ethereum axs kava solana avax btc httpstcocQ8DjzhaDV,-0.0258,0.103,0.788,0.108,0,"['No', 'red', 'candle', 'SHIBA', 'always', 'Green', 'gt', 'BULLISH', 'forever', 'shiba', 'shib', 'ethereum', 'ax', 'kava', 'solana', 'avax', 'btc', 'httpstcocQ8DjzhaDV']"
17,2022-04-14 20:51:41,Good project Clockx24 UTK Ethereum httpstcoueVd3bxF4P,0.4404,0.367,0.633,0.0,1,"['Good', 'project', 'Clockx24', 'UTK', 'Ethereum', 'httpstcoueVd3bxF4P']"
18,2022-04-14 20:51:41,Bitcoin Last Price 40975 BTC  Daily Indicators RSI 425 MA20 44230 MA50 42082 MA200 4160 Bollinger B lowerupper 3922449237 Ethereum Last 3080 ETH RSI 474 MA20 3272 MA50 2968 MA200 341 BB 2913583 DM project price Crypto Live 33245,0.0,0.0,1.0,0.0,0,"['Bitcoin', 'Last', 'Price', '40975', 'BTC', 'Daily', 'Indicators', 'RSI', '425', 'MA20', '44230', 'MA50', '42082', 'MA200', '4160', 'Bollinger', 'B', 'lowerupper', '3922449237', 'Ethereum', 'Last', '3080', 'ETH', 'RSI', '474', 'MA20', '3272', 'MA50', '2968', 'MA200', '341', 'BB', '2913583', 'DM', 'project', 'price', 'Crypto', 'Live', '33245']"
19,2022-04-14 20:51:41,Great project Clockx24 UTK Ethereum KennyHerper Ryuaka009 cooldude19 httpstcoiUV1egPPs,0.6249,0.339,0.661,0.0,1,"['Great', 'project', 'Clockx24', 'UTK', 'Ethereum', 'KennyHerper', 'Ryuaka009', 'cooldude19', 'httpstcoiUV1egPPs']"
20,2022-04-14 20:51:41,TRACE TRACE altcoinnews BTC Ethereum nearNFTs NFTs NFTCommunity Metaverse BUDDY httpstco6O6yu7ehx0,0.0,0.0,1.0,0.0,0,"['TRACE', 'TRACE', 'altcoinnews', 'BTC', 'Ethereum', 'nearNFTs', 'NFTs', 'NFTCommunity', 'Metaverse', 'BUDDY', 'httpstco6O6yu7ehx0']"
21,2022-04-14 20:51:40,RT VispXofficial VispX Ecosystem Explained Delivering innovation dual model launchpad powered high quality projects B,0.3818,0.167,0.833,0.0,1,"['RT', 'VispXofficial', 'VispX', 'Ecosystem', 'Explained', 'Delivering', 'innovation', 'dual', 'model', 'launchpad', 'powered', 'high', 'quality', 'project', 'B']"
22,2022-04-14 20:51:40,nfts nft nftart nftcommunity nftcollector nftartist crypto digitalart cryptoart art ethereum opensea nftcollectors blockchain nftdrop cryptocurrency nftcollectibles bitcoin openseanft nftcollection cryptoartist nftartists eth httpstcoxh3hmCVl47,0.0,0.0,1.0,0.0,0,"['nfts', 'nft', 'nftart', 'nftcommunity', 'nftcollector', 'nftartist', 'crypto', 'digitalart', 'cryptoart', 'art', 'ethereum', 'opensea', 'nftcollectors', 'blockchain', 'nftdrop', 'cryptocurrency', 'nftcollectibles', 'bitcoin', 'openseanft', 'nftcollection', 'cryptoartist', 'nftartists', 'eth', 'httpstcoxh3hmCVl47']"
23,2022-04-14 20:51:39,NFTGiveaways  We giving away FREE NFTs To selected Follow NftsFans Retweet Like Tag 3 friends cryptocurrency NFTCommunity NFTGiveaways NFTartist NFTdrop NFTProject NFT APE SolanaNFTs OpenSeaNFT Ethereum ETHNFTs httpstco0Z49TH3Rpl httpstc1WI1VqILB,0.9008,0.334,0.666,0.0,1,"['NFTGiveaways', 'We', 'giving', 'away', 'FREE', 'NFTs', 'To', 'selected', 'Follow', 'NftsFans', 'Retweet', 'Like', 'Tag', '3', 'friend', 'cryptocurrency', 'NFTCommunity', 'NFTGiveaways', 'NFTartist', 'NFTdrop', 'NFTProject', 'NFT', 'APE', 'SolanaNFTs', 'OpenSeaNFT', 'Ethereum', 'ETHNFTs', 'httpstco0Z49TH3Rpl', 'httpstc1WI1VqILB']"
24,2022-04-14 20:51:39,RT BabydogeFanbase Its BabyDoge King Meme Coins  Holders150621  Twitter Followers17414   BabyDogeC,0.0,0.0,1.0,0.0,0,"['RT', 'BabydogeFanbase', 'Its', 'BabyDoge', 'King', 'Meme', 'Coins', 'Holders150621', 'Twitter', 'Followers17414', 'BabyDogeC']"
25,2022-04-14 20:51:39,RT uddomains For Sale Blockchain Domain opensea ZillionaireWallet Make account Unstoppable Domains  httpstcoafvduKR674,-0.2023,0.0,0.87,0.13,-1,"['RT', 'uddomains', 'For', 'Sale', 'Blockchain', 'Domain', 'opensea', 'ZillionaireWallet', 'Make', 'account', 'Unstoppable', 'Domains', 'httpstcoafvduKR674']"
26,2022-04-14 20:51:38,RT xyfinance Activate singlechain trading cronoschain amp ThunderProtocol  You swap token onacross BNBChain ethereum,0.0,0.0,1.0,0.0,0,"['RT', 'xyfinance', 'Activate', 'singlechain', 'trading', 'cronoschain', 'amp', 'ThunderProtocol', 'You', 'swap', 'token', 'onacross', 'BNBChain', 'ethereum']"
27,2022-04-14 20:51:38,RT CryptoListy The DuneAnalytics platform tool dramatically simplifies process It webbased platform querying E,0.0,0.0,1.0,0.0,0,"['RT', 'CryptoListy', 'The', 'DuneAnalytics', 'platform', 'tool', 'dramatically', 'simplifies', 'process', 'It', 'webbased', 'platform', 'querying', 'E']"
28,2022-04-14 20:51:37,RT GrumpyBearTC Are ready big news Stay tuned nfts nft nftart nftcommunity nftcollector nftartist crypto digitala,0.3612,0.143,0.857,0.0,1,"['RT', 'GrumpyBearTC', 'Are', 'ready', 'big', 'news', 'Stay', 'tuned', 'nfts', 'nft', 'nftart', 'nftcommunity', 'nftcollector', 'nftartist', 'crypto', 'digitala']"
29,2022-04-14 20:51:36,PresentsAirdrop Nice project Clockx24 UTK Ethereum Airdrophunnter AirdropDaily VAKARMALIK7,0.4215,0.259,0.741,0.0,1,"['PresentsAirdrop', 'Nice', 'project', 'Clockx24', 'UTK', 'Ethereum', 'Airdrophunnter', 'AirdropDaily', 'VAKARMALIK7']"
30,2022-04-14 20:51:35,RT IsaacSmith77 AMAZING Ethereum mining revenue managed outperform Bitcoin third month row  Achieving10,0.6739,0.274,0.726,0.0,1,"['RT', 'IsaacSmith77', 'AMAZING', 'Ethereum', 'mining', 'revenue', 'managed', 'outperform', 'Bitcoin', 'third', 'month', 'row', 'Achieving10']"
31,2022-04-14 20:51:35,UM ALFRED  0071 ETH 15 POP PEOPLE collection Buy  httpstcodMkCUTsaf0 via opensea Crypto Ethereum EthereumNFTs nft NFTs OpenSeaNFT openseanfts openseanftart NFTCommunity opensea NFTartwork httpstcoueepAs2QWp,0.0,0.0,1.0,0.0,0,"['UM', 'ALFRED', '0071', 'ETH', '15', 'POP', 'PEOPLE', 'collection', 'Buy', 'httpstcodMkCUTsaf0', 'via', 'opensea', 'Crypto', 'Ethereum', 'EthereumNFTs', 'nft', 'NFTs', 'OpenSeaNFT', 'openseanfts', 'openseanftart', 'NFTCommunity', 'opensea', 'NFTartwork', 'httpstcoueepAs2QWp']"
32,2022-04-14 20:51:34,Arthur Hayes said scenario Ethereum could fall 2500,0.0,0.0,1.0,0.0,0,"['Arthur', 'Hayes', 'said', 'scenario', 'Ethereum', 'could', 'fall', '2500']"
33,2022-04-14 20:51:33,RT CryptoFarmsNFT Here folks were proud partnered BigBangAirdrops massive GIVEAWAY collab event 24 projects,0.4767,0.193,0.807,0.0,1,"['RT', 'CryptoFarmsNFT', 'Here', 'folk', 'proud', 'partnered', 'BigBangAirdrops', 'massive', 'GIVEAWAY', 'collab', 'event', '24', 'project']"
34,2022-04-14 20:51:33,RT VispXofficial VispX Ecosystem Explained Delivering innovation dual model launchpad powered high quality projects B,0.3818,0.167,0.833,0.0,1,"['RT', 'VispXofficial', 'VispX', 'Ecosystem', 'Explained', 'Delivering', 'innovation', 'dual', 'model', 'launchpad', 'powered', 'high', 'quality', 'project', 'B']"
35,2022-04-14 20:51:32,Can Ethereum Resume Uptrend As Shift ProofofStake Gets Postponed  FXLeaders httpstcoUtY3Jq3r7g,-0.2023,0.0,0.847,0.153,-1,"['Can', 'Ethereum', 'Resume', 'Uptrend', 'As', 'Shift', 'ProofofStake', 'Gets', 'Postponed', 'FXLeaders', 'httpstcoUtY3Jq3r7g']"
36,2022-04-14 20:51:32,Powerful project dont want miss Ethereum Bull CX24 fitkwik lekzit10 abbe1759 httpstco5arbzDVvKK,0.4628,0.293,0.622,0.084,1,"['Powerful', 'project', 'dont', 'want', 'miss', 'Ethereum', 'Bull', 'CX24', 'fitkwik', 'lekzit10', 'abbe1759', 'httpstco5arbzDVvKK']"
37,2022-04-14 20:51:32,kucoincom BabyDogeCoin BabyDogeCoin BabyDogeArmy NFTGiveaway nftcollector NFTs elonmusk ElonMusk Tesla Tesla binance BinanceSmartChain ethereum VitalikButerin WhaleEthe ethclassic etherium Ether ethereumNFT Bitcoin Bitrue,0.0,0.0,1.0,0.0,0,"['kucoincom', 'BabyDogeCoin', 'BabyDogeCoin', 'BabyDogeArmy', 'NFTGiveaway', 'nftcollector', 'NFTs', 'elonmusk', 'ElonMusk', 'Tesla', 'Tesla', 'binance', 'BinanceSmartChain', 'ethereum', 'VitalikButerin', 'WhaleEthe', 'ethclassic', 'etherium', 'Ether', 'ethereumNFT', 'Bitcoin', 'Bitrue']"
38,2022-04-14 20:51:32,Well This pretty big news btc bitcoin ethereum ETH Crypto NFTGiveaway httpstco8J5qzXUYaZ,0.6486,0.346,0.654,0.0,1,"['Well', 'This', 'pretty', 'big', 'news', 'btc', 'bitcoin', 'ethereum', 'ETH', 'Crypto', 'NFTGiveaway', 'httpstco8J5qzXUYaZ']"
39,2022-04-14 20:51:30,Nftshiil This music project VogelhausNFT made TheRealKidSound steezyapegang It also grants WLspot upcoming generative collection Would cool could check  httpstcoO1l11Vl,0.4939,0.189,0.811,0.0,1,"['Nftshiil', 'This', 'music', 'project', 'VogelhausNFT', 'made', 'TheRealKidSound', 'steezyapegang', 'It', 'also', 'grant', 'WLspot', 'upcoming', 'generative', 'collection', 'Would', 'cool', 'could', 'check', 'httpstcoO1l11Vl']"
40,2022-04-14 20:51:30,RT suavloraeth NFTGiveaway 1x Goat Elves NFT Worth 69 SOL Follow goatelves amp suavloraeth  amp RT Tag 3 Frens,0.2263,0.101,0.899,0.0,1,"['RT', 'suavloraeth', 'NFTGiveaway', '1x', 'Goat', 'Elves', 'NFT', 'Worth', '69', 'SOL', 'Follow', 'goatelves', 'amp', 'suavloraeth', 'amp', 'RT', 'Tag', '3', 'Frens']"
41,2022-04-14 20:51:29,RT GANartNFT You dream Etherum landscape wake100ETH New mint amp NFT list Impossible worlds NFTCollection ,0.25,0.125,0.875,0.0,1,"['RT', 'GANartNFT', 'You', 'dream', 'Etherum', 'landscape', 'wake100ETH', 'New', 'mint', 'amp', 'NFT', 'list', 'Impossible', 'world', 'NFTCollection']"
42,2022-04-14 20:51:27,RT getttbetter listed new butterfly Deadly calm scorching night little bit heat always welcomed dont agree 0,0.3798,0.237,0.656,0.107,1,"['RT', 'getttbetter', 'listed', 'new', 'butterfly', 'Deadly', 'calm', 'scorching', 'night', 'little', 'bit', 'heat', 'always', 'welcomed', 'dont', 'agree', '0']"
43,2022-04-14 20:51:26,RT VispXofficial VispX Ecosystem Explained Delivering innovation dual model launchpad powered high quality projects B,0.3818,0.167,0.833,0.0,1,"['RT', 'VispXofficial', 'VispX', 'Ecosystem', 'Explained', 'Delivering', 'innovation', 'dual', 'model', 'launchpad', 'powered', 'high', 'quality', 'project', 'B']"
44,2022-04-14 20:51:26,Arthur Hayes said scenario Ethereum could fall 2500,0.0,0.0,1.0,0.0,0,"['Arthur', 'Hayes', 'said', 'scenario', 'Ethereum', 'could', 'fall', '2500']"
45,2022-04-14 20:51:25,RT PolkaFoundry  Gear up Good news arrived  PKF list 50 tokens Ethereum network could listed Coinb,0.4404,0.162,0.838,0.0,1,"['RT', 'PolkaFoundry', 'Gear', 'Good', 'news', 'arrived', 'PKF', 'list', '50', 'token', 'Ethereum', 'network', 'could', 'listed', 'Coinb']"
46,2022-04-14 20:51:24,ethaxcrypto ethaxtoken DEX cryptocurrency Ethereum BinanceSmartChain Bitcoin httpstco6RS9AIOnfP,0.0,0.0,1.0,0.0,0,"['ethaxcrypto', 'ethaxtoken', 'DEX', 'cryptocurrency', 'Ethereum', 'BinanceSmartChain', 'Bitcoin', 'httpstco6RS9AIOnfP']"
47,2022-04-14 20:51:24,RT CryptoSuperApe  Samurai Hanzo  FAIRLAUNCH DATE  14042022 1900 UTC  PLAY TO EARN TOKEN  8 Ethereum Rewards TG http,0.7378,0.294,0.706,0.0,1,"['RT', 'CryptoSuperApe', 'Samurai', 'Hanzo', 'FAIRLAUNCH', 'DATE', '14042022', '1900', 'UTC', 'PLAY', 'TO', 'EARN', 'TOKEN', '8', 'Ethereum', 'Rewards', 'TG', 'http']"
48,2022-04-14 20:51:24,RT vEmpireDDAO vEmpire VEMP bought billion CULT ETH strategy 62 Ethereum wearecultdao  We know read an,0.0,0.0,1.0,0.0,0,"['RT', 'vEmpireDDAO', 'vEmpire', 'VEMP', 'bought', 'billion', 'CULT', 'ETH', 'strategy', '62', 'Ethereum', 'wearecultdao', 'We', 'know', 'read']"
49,2022-04-14 20:51:24,Yes ReglaAlger What mean dont know identity Memento MeMEthereum scammer rat Remember wallet public  Tick tock ser  Are still working fractalprtcl httpstcofQcivemHkQ,0.4019,0.114,0.886,0.0,1,"['Yes', 'ReglaAlger', 'What', 'mean', 'dont', 'know', 'identity', 'Memento', 'MeMEthereum', 'scammer', 'rat', 'Remember', 'wallet', 'public', 'Tick', 'tock', 'ser', 'Are', 'still', 'working', 'fractalprtcl', 'httpstcofQcivemHkQ']"
50,2022-04-14 20:51:24, NFT  GAGNER   TENTE DE GAGNER CE NFT DUNE VALEUR DE18 ETH   CONDITIONS   FOLLOW 0xNFTgiveaway  RT ET LIKE TAS  48H  NFT NFTGiveaway cryptocurrency Giveaway Concours sorare Cryptos business Ethereum Bitcoin nftart Solana BNB httpstco33KMfzBjRo,0.4995,0.092,0.908,0.0,1,"['NFT', 'GAGNER', 'TENTE', 'DE', 'GAGNER', 'CE', 'NFT', 'DUNE', 'VALEUR', 'DE18', 'ETH', 'CONDITIONS', 'FOLLOW', '0xNFTgiveaway', 'RT', 'ET', 'LIKE', 'TAS', '48H', 'NFT', 'NFTGiveaway', 'cryptocurrency', 'Giveaway', 'Concours', 'sorare', 'Cryptos', 'business', 'Ethereum', 'Bitcoin', 'nftart', 'Solana', 'BNB', 'httpstco33KMfzBjRo']"
51,2022-04-14 20:51:24,Top10 Coins Social engagement over last 24 hrs LunarCrush btc bitcoin eth ethereum doge dogecoin xtz tezos cake pancakeswap sdt terrasdt shib shibainu ada cardano matic polygon rari rarible httpstcod89wXZzHMr,0.4588,0.094,0.906,0.0,1,"['Top10', 'Coins', 'Social', 'engagement', 'last', '24', 'hr', 'LunarCrush', 'btc', 'bitcoin', 'eth', 'ethereum', 'doge', 'dogecoin', 'xtz', 'tezos', 'cake', 'pancakeswap', 'sdt', 'terrasdt', 'shib', 'shibainu', 'ada', 'cardano', 'matic', 'polygon', 'rari', 'rarible', 'httpstcod89wXZzHMr']"
52,2022-04-14 20:51:23,httpstcoGmroq6cFoZ monopolyonchain realestate blockchain bitcoin ethereum binance MPT airdrop,0.0,0.0,1.0,0.0,0,"['httpstcoGmroq6cFoZ', 'monopolyonchain', 'realestate', 'blockchain', 'bitcoin', 'ethereum', 'binance', 'MPT', 'airdrop']"
53,2022-04-14 20:51:23,Mushy 3  NFTGiveaways nftart NFTCommunity nft NFTdrop nftcollector NFTCommmunity ETH Ethereum btc cryptocurrency cryptoartist Cryptoart nftlover NFTThaicommunity NFTNYC NFTsales NFT httpstcovGP6E2wjqH httpstcobv3TB0oThl,0.0,0.0,1.0,0.0,0,"['Mushy', '3', 'NFTGiveaways', 'nftart', 'NFTCommunity', 'nft', 'NFTdrop', 'nftcollector', 'NFTCommmunity', 'ETH', 'Ethereum', 'btc', 'cryptocurrency', 'cryptoartist', 'Cryptoart', 'nftlover', 'NFTThaicommunity', 'NFTNYC', 'NFTsales', 'NFT', 'httpstcovGP6E2wjqH', 'httpstcobv3TB0oThl']"
54,2022-04-14 20:51:23,RT Supersnailsnft  500000 GIVEAWAY FOR SUPERSNAILS NFT HOLDERS  Feast eyes BIGGEST MOST EPIC GIVEAWAY NFTGivea,0.0,0.0,1.0,0.0,0,"['RT', 'Supersnailsnft', '500000', 'GIVEAWAY', 'FOR', 'SUPERSNAILS', 'NFT', 'HOLDERS', 'Feast', 'eye', 'BIGGEST', 'MOST', 'EPIC', 'GIVEAWAY', 'NFTGivea']"
55,2022-04-14 20:51:23,RT VispXofficial VispX Ecosystem Explained Delivering innovation dual model launchpad powered high quality projects B,0.3818,0.167,0.833,0.0,1,"['RT', 'VispXofficial', 'VispX', 'Ecosystem', 'Explained', 'Delivering', 'innovation', 'dual', 'model', 'launchpad', 'powered', 'high', 'quality', 'project', 'B']"
56,2022-04-14 20:51:23,RT Supersnailsnft  500000 GIVEAWAY FOR SUPERSNAILS NFT HOLDERS  Feast eyes BIGGEST MOST EPIC GIVEAWAY NFTGivea,0.0,0.0,1.0,0.0,0,"['RT', 'Supersnailsnft', '500000', 'GIVEAWAY', 'FOR', 'SUPERSNAILS', 'NFT', 'HOLDERS', 'Feast', 'eye', 'BIGGEST', 'MOST', 'EPIC', 'GIVEAWAY', 'NFTGivea']"
57,2022-04-14 20:51:22,VerfiedAirdrop Clockx24 UTK ethereum meysamrezaei HasanAmini HasanAmjad1,0.0,0.0,1.0,0.0,0,"['VerfiedAirdrop', 'Clockx24', 'UTK', 'ethereum', 'meysamrezaei', 'HasanAmini', 'HasanAmjad1']"
58,2022-04-14 20:51:22,RT NFTBattleMiners Were back And time were proud present massive collaboration 24 projects spanning WAX,0.4767,0.181,0.819,0.0,1,"['RT', 'NFTBattleMiners', 'Were', 'back', 'And', 'time', 'proud', 'present', 'massive', 'collaboration', '24', 'project', 'spanning', 'WAX']"
59,2022-04-14 20:51:22,RT smallcappick vEmpireDDAO VEMP bought billion CULT ETH strategy 62 Ethereum wearecultdao wearecultdao vEmp,0.0,0.0,1.0,0.0,0,"['RT', 'smallcappick', 'vEmpireDDAO', 'VEMP', 'bought', 'billion', 'CULT', 'ETH', 'strategy', '62', 'Ethereum', 'wearecultdao', 'wearecultdao', 'vEmp']"
60,2022-04-14 20:51:21,RT namehoty If opportunity go back past moment event life would change You may purchase m,0.4215,0.167,0.833,0.0,1,"['RT', 'namehoty', 'If', 'opportunity', 'go', 'back', 'past', 'moment', 'event', 'life', 'would', 'change', 'You', 'may', 'purchase']"
61,2022-04-14 20:51:21,RT GrumpyBearTC Are ready big news Stay tuned nfts nft nftart nftcommunity nftcollector nftartist crypto digitala,0.3612,0.143,0.857,0.0,1,"['RT', 'GrumpyBearTC', 'Are', 'ready', 'big', 'news', 'Stay', 'tuned', 'nfts', 'nft', 'nftart', 'nftcommunity', 'nftcollector', 'nftartist', 'crypto', 'digitala']"
62,2022-04-14 20:51:19,RT getttbetter listed new creature Attachment something obsessed with 1 ETH NFT NFTs NFTCommuni,0.128,0.148,0.738,0.114,1,"['RT', 'getttbetter', 'listed', 'new', 'creature', 'Attachment', 'something', 'obsessed', '1', 'ETH', 'NFT', 'NFTs', 'NFTCommuni']"
63,2022-04-14 20:51:18,RT seankelly25 Gopniks Chain ETH GIVEAWAY  Prize1 ETH To enter1 Follow GopniksOTC amp DinosChibi 2 Like amp RT 3 Tag 2,0.3612,0.128,0.872,0.0,1,"['RT', 'seankelly25', 'Gopniks', 'Chain', 'ETH', 'GIVEAWAY', 'Prize1', 'ETH', 'To', 'enter1', 'Follow', 'GopniksOTC', 'amp', 'DinosChibi', '2', 'Like', 'amp', 'RT', '3', 'Tag', '2']"
64,2022-04-14 20:51:18,RT Tomlew211389 APE IS GOOD cryptocurrency dogecoin DogeCola BSCGem Ethereum NFTs httpstco2Pe0vzud2F,0.5622,0.248,0.752,0.0,1,"['RT', 'Tomlew211389', 'APE', 'IS', 'GOOD', 'cryptocurrency', 'dogecoin', 'DogeCola', 'BSCGem', 'Ethereum', 'NFTs', 'httpstco2Pe0vzud2F']"
65,2022-04-14 20:51:18,RT CryptosunshineO Look I found Achoo collectible1Edition Open For Bids httpstcoEBzL7YPS1 rarible ethereum nonfungibl,0.0,0.0,1.0,0.0,0,"['RT', 'CryptosunshineO', 'Look', 'I', 'found', 'Achoo', 'collectible1Edition', 'Open', 'For', 'Bids', 'httpstcoEBzL7YPS1', 'rarible', 'ethereum', 'nonfungibl']"
66,2022-04-14 20:51:17, Tim Beiko  leading Ethereum development coordinator  stated network not implement proof stake June This contradicts Vitalik Buterins development timeline January claimed place Q2 2022 ETH httpstcoTBIuZQwuP6,-0.34,0.0,0.912,0.088,-1,"['Tim', 'Beiko', 'leading', 'Ethereum', 'development', 'coordinator', 'stated', 'network', 'implement', 'proof', 'stake', 'June', 'This', 'contradicts', 'Vitalik', 'Buterins', 'development', 'timeline', 'January', 'claimed', 'place', 'Q2', '2022', 'ETH', 'httpstcoTBIuZQwuP6']"
67,2022-04-14 20:51:17,RT NFTClubbing Fast NFTGiveaway Surprise NFTs clubs collection 20 Winner every100RT Rules Enter active giveawa,0.8225,0.417,0.583,0.0,1,"['RT', 'NFTClubbing', 'Fast', 'NFTGiveaway', 'Surprise', 'NFTs', 'club', 'collection', '20', 'Winner', 'every100RT', 'Rules', 'Enter', 'active', 'giveawa']"
68,2022-04-14 20:51:17,RT maliheahmadi92 httpstco3FUMq2QMfn rarible ethereum nonfungible digitalasset nft via rarible  nft105 i,0.0,0.0,1.0,0.0,0,"['RT', 'maliheahmadi92', 'httpstco3FUMq2QMfn', 'rarible', 'ethereum', 'nonfungible', 'digitalasset', 'nft', 'via', 'rarible', 'nft105']"
69,2022-04-14 20:51:15,RT Rchronicls The time come Join Discord httpstcot6FjsHHNbX reptilechronicles reptile opensea ethereum nftdrop nf,-0.128,0.13,0.71,0.16,-1,"['RT', 'Rchronicls', 'The', 'time', 'come', 'Join', 'Discord', 'httpstcot6FjsHHNbX', 'reptilechronicles', 'reptile', 'opensea', 'ethereum', 'nftdrop', 'nf']"
70,2022-04-14 20:51:15,ArcaneKingdoms next generation play2earn crypto game Their pre sale start days also giving away 50000100000 tokens Check out ArcaneKingdoms Bitcoin Bnb bsc ethereum giveaway presale airdrop httpstcoB6k50FtJKw,0.34,0.085,0.915,0.0,1,"['ArcaneKingdoms', 'next', 'generation', 'play2earn', 'crypto', 'game', 'Their', 'pre', 'sale', 'start', 'day', 'also', 'giving', 'away', '50000100000', 'token', 'Check', 'ArcaneKingdoms', 'Bitcoin', 'Bnb', 'bsc', 'ethereum', 'giveaway', 'presale', 'airdrop', 'httpstcoB6k50FtJKw']"
71,2022-04-14 20:51:14,TRACE TRACE altcoinnews BTC Ethereum nearNFTs NFTs NFTCommunity Metaverse BUDDY httpstcoxmnbnltBIH,0.0,0.0,1.0,0.0,0,"['TRACE', 'TRACE', 'altcoinnews', 'BTC', 'Ethereum', 'nearNFTs', 'NFTs', 'NFTCommunity', 'Metaverse', 'BUDDY', 'httpstcoxmnbnltBIH']"
72,2022-04-14 20:51:13,RT KromatikaFi KromatikaFi brought unique solution traders limit trading DEX without swap fees no price slippage a,0.4919,0.23,0.77,0.0,1,"['RT', 'KromatikaFi', 'KromatikaFi', 'brought', 'unique', 'solution', 'trader', 'limit', 'trading', 'DEX', 'without', 'swap', 'fee', 'price', 'slippage']"
73,2022-04-14 20:51:13,Bitcoin salta com pico de saques Ethereum mostra fora e Dogecoin dispara com oferta de Elon Musk por Twitter httpstco3aZce2hnMl via InfoMoney,0.0,0.0,1.0,0.0,0,"['Bitcoin', 'salta', 'com', 'pico', 'de', 'saques', 'Ethereum', 'mostra', 'forum', 'e', 'Dogecoin', 'dispara', 'com', 'oferta', 'de', 'Elon', 'Musk', 'por', 'Twitter', 'httpstco3aZce2hnMl', 'via', 'InfoMoney']"
74,2022-04-14 20:51:13,Good project AbdulNalband2 AmolLabade8 kudachesiraj EthereumUTKClockx24 httpstcod6IVtYb0Ad,0.4404,0.326,0.674,0.0,1,"['Good', 'project', 'AbdulNalband2', 'AmolLabade8', 'kudachesiraj', 'EthereumUTKClockx24', 'httpstcod6IVtYb0Ad']"
