,id,text,text_compound,text_pos,text_neu,text_neg,text_sent,token_text
75,2022-04-14 20:51:13,RT RichardHeartWin Ethereum trying change proof work proof stake It not reduce gas fees It delayed til,-0.2263,0.0,0.894,0.106,-1,"['RT', 'RichardHeartWin', 'Ethereum', 'trying', 'change', 'proof', 'work', 'proof', 'stake', 'It', 'reduce', 'gas', 'fee', 'It', 'delayed', 'til']"
76,2022-04-14 20:51:11,RT ETHDaily  Mostmentioned ERC20 Projects Twitter The Last 7D  BABYDOGE BabyDogeCoin  RARI rarible  RISE EverRi,0.0,0.0,1.0,0.0,0,"['RT', 'ETHDaily', 'Mostmentioned', 'ERC20', 'Projects', 'Twitter', 'The', 'Last', '7D', 'BABYDOGE', 'BabyDogeCoin', 'RARI', 'rarible', 'RISE', 'EverRi']"
77,2022-04-14 20:51:11,RT TekinogluDogu Yksek enflasyon beklentisinde piyasalarda nasl uzun vade plan izilir Acemi gibi hiper enflasyon mu beklenmeli,0.0,0.0,1.0,0.0,0,"['RT', 'TekinogluDogu', 'Yksek', 'enflasyon', 'beklentisinde', 'piyasalarda', 'nasl', 'uzun', 'vade', 'plan', 'izilir', 'Acemi', 'gibi', 'hiper', 'enflasyon', 'mu', 'beklenmeli']"
78,2022-04-14 20:51:11,mnbv675 lkjh489354 poiuyqwertgf Clockx24 UTK Ethereum httpstcoStkfUgIscQ,0.0,0.0,1.0,0.0,0,"['mnbv675', 'lkjh489354', 'poiuyqwertgf', 'Clockx24', 'UTK', 'Ethereum', 'httpstcoStkfUgIscQ']"
79,2022-04-14 20:51:10,Uniqlyio Hi guys I present1000xgem ethshiba project Ethereum amp Shiba lovers launched Binance Smart Chain They offer Ethereum rewards holding tokens ETHSHIB Telegram httpstcoQ3JErMGLg3,0.8658,0.36,0.64,0.0,1,"['Uniqlyio', 'Hi', 'guy', 'I', 'present1000xgem', 'ethshiba', 'project', 'Ethereum', 'amp', 'Shiba', 'lover', 'launched', 'Binance', 'Smart', 'Chain', 'They', 'offer', 'Ethereum', 'reward', 'holding', 'token', 'ETHSHIB', 'Telegram', 'httpstcoQ3JErMGLg3']"
80,2022-04-14 20:51:10,RT KyriakouArianna FIRST 40 WHO DOES THE TASK 1 FOLLOW KyriakouArianna AND ElPalerm12 2 httpstco7n7Wj8eBbH LIKE ALL,0.4995,0.188,0.812,0.0,1,"['RT', 'KyriakouArianna', 'FIRST', '40', 'WHO', 'DOES', 'THE', 'TASK', '1', 'FOLLOW', 'KyriakouArianna', 'AND', 'ElPalerm12', '2', 'httpstco7n7Wj8eBbH', 'LIKE', 'ALL']"
81,2022-04-14 20:51:10,RT181Erdem CEEK OK SERT YKSELD  binance LSTELEMES GELYORMU  CEEK 1010KAT1020X20KAT 2040X40KAT CEEK Bitcoin Ethere,0.4466,0.184,0.816,0.0,1,"['RT181Erdem', 'CEEK', 'OK', 'SERT', 'YKSELD', 'binance', 'LSTELEMES', 'GELYORMU', 'CEEK', '1010KAT1020X20KAT', '2040X40KAT', 'CEEK', 'Bitcoin', 'Ethere']"
82,2022-04-14 20:51:09,RT bubblezworldnft  Whitelist  Eth Giveaway  Giving away 3 Chippasses WL chiposnft Plus1 person receive 500 Eth To,0.34,0.138,0.862,0.0,1,"['RT', 'bubblezworldnft', 'Whitelist', 'Eth', 'Giveaway', 'Giving', 'away', '3', 'Chippasses', 'WL', 'chiposnft', 'Plus1', 'person', 'receive', '500', 'Eth', 'To']"
83,2022-04-14 20:51:08,RT RsGrowth Gain insightful information reigns Cryptocurrency RS Growth RSGrowth digital marketing crypto Cryptocurr,0.7184,0.333,0.667,0.0,1,"['RT', 'RsGrowth', 'Gain', 'insightful', 'information', 'reign', 'Cryptocurrency', 'RS', 'Growth', 'RSGrowth', 'digital', 'marketing', 'crypto', 'Cryptocurr']"
84,2022-04-14 20:51:08,ABC Look I found Salvator Mund collectible httpstcoZkg5jMIqoa rarible ethereum nonfungible digitalasset nft via rarible,0.0,0.0,1.0,0.0,0,"['ABC', 'Look', 'I', 'found', 'Salvator', 'Mund', 'collectible', 'httpstcoZkg5jMIqoa', 'rarible', 'ethereum', 'nonfungible', 'digitalasset', 'nft', 'via', 'rarible']"
85,2022-04-14 20:51:08,Raffeth This music project VogelhausNFT made TheRealKidSound steezyapegang It also grants WLspot upcoming generative collection Would cool could check  httpstcoO1l11Vl,0.4939,0.189,0.811,0.0,1,"['Raffeth', 'This', 'music', 'project', 'VogelhausNFT', 'made', 'TheRealKidSound', 'steezyapegang', 'It', 'also', 'grant', 'WLspot', 'upcoming', 'generative', 'collection', 'Would', 'cool', 'could', 'check', 'httpstcoO1l11Vl']"
86,2022-04-14 20:51:06,nfts nft nftart nftcommunity nftcollector nftartist crypto digitalart cryptoart art ethereum opensea nftcollectors blockchain nftdrop cryptocurrency httpstcoOMDy0d3WTy,0.0,0.0,1.0,0.0,0,"['nfts', 'nft', 'nftart', 'nftcommunity', 'nftcollector', 'nftartist', 'crypto', 'digitalart', 'cryptoart', 'art', 'ethereum', 'opensea', 'nftcollectors', 'blockchain', 'nftdrop', 'cryptocurrency', 'httpstcoOMDy0d3WTy']"
87,2022-04-14 20:51:06,RT RegToshi GemmMinato ShibaMinato MinatoKanjiArmy MinatoKanji Looks awesome Gemm Even u MINATO lfgooooooo  Eth ,0.6249,0.255,0.745,0.0,1,"['RT', 'RegToshi', 'GemmMinato', 'ShibaMinato', 'MinatoKanjiArmy', 'MinatoKanji', 'Looks', 'awesome', 'Gemm', 'Even', 'MINATO', 'lfgooooooo', 'Eth']"
88,2022-04-14 20:51:05,Rich Dad Poor Dad Author Says One Ethereum Competitor Is Just Getting Started Predicts Inflation Will Wipe Out US Economy httpstcokTZUB4Jo0H,0.128,0.14,0.739,0.121,1,"['Rich', 'Dad', 'Poor', 'Dad', 'Author', 'Says', 'One', 'Ethereum', 'Competitor', 'Is', 'Just', 'Getting', 'Started', 'Predicts', 'Inflation', 'Will', 'Wipe', 'Out', 'US', 'Economy', 'httpstcokTZUB4Jo0H']"
89,2022-04-14 20:51:05,ETHGate xrp Ripple crypto clarity Corruption Ethereum SECcorruption SECMafia Theyallgoingtojail GaryGensler SECGov VitalikButerin ethereumJoseph httpstcoE0bV216su,0.4019,0.162,0.838,0.0,1,"['ETHGate', 'xrp', 'Ripple', 'crypto', 'clarity', 'Corruption', 'Ethereum', 'SECcorruption', 'SECMafia', 'Theyallgoingtojail', 'GaryGensler', 'SECGov', 'VitalikButerin', 'ethereumJoseph', 'httpstcoE0bV216su']"
90,2022-04-14 20:51:04,RT VispXofficial VispX Ecosystem Explained Delivering innovation dual model launchpad powered high quality projects B,0.3818,0.167,0.833,0.0,1,"['RT', 'VispXofficial', 'VispX', 'Ecosystem', 'Explained', 'Delivering', 'innovation', 'dual', 'model', 'launchpad', 'powered', 'high', 'quality', 'project', 'B']"
91,2022-04-14 20:51:03,888Velvet We short time Bitcoin never rises summer Ethereum merge postpone June fall What think about,-0.2263,0.0,0.888,0.112,-1,"['888Velvet', 'We', 'short', 'time', 'Bitcoin', 'never', 'rise', 'summer', 'Ethereum', 'merge', 'postpone', 'June', 'fall', 'What', 'think']"
92,2022-04-14 20:51:03,Domain name sale httpstcoYQ1uuSekR Nft OpenSea Ethereum Airdrop Metaverse GameFi gaming Web3 domainnames DomainNameForSale,0.0,0.0,1.0,0.0,0,"['Domain', 'name', 'sale', 'httpstcoYQ1uuSekR', 'Nft', 'OpenSea', 'Ethereum', 'Airdrop', 'Metaverse', 'GameFi', 'gaming', 'Web3', 'domainnames', 'DomainNameForSale']"
93,2022-04-14 20:51:02,RT VogelhausNFT Whos collecting NfTmusic  This beauty also grants WL spot steezyapegang upcoming Generative NFTComm,0.6908,0.305,0.695,0.0,1,"['RT', 'VogelhausNFT', 'Whos', 'collecting', 'NfTmusic', 'This', 'beauty', 'also', 'grant', 'WL', 'spot', 'steezyapegang', 'upcoming', 'Generative', 'NFTComm']"
94,2022-04-14 20:51:01,ETHereum ETH impulse bar 307725  308697 ETH Bar close 30178 Crypto short term volatility detection,0.0,0.0,1.0,0.0,0,"['ETHereum', 'ETH', 'impulse', 'bar', '307725', '308697', 'ETH', 'Bar', 'close', '30178', 'Crypto', 'short', 'term', 'volatility', 'detection']"
95,2022-04-14 20:51:01,VerfiedAirdrop Good project naufalbayanaka faisalabian naufalfadlan Clockx24 UTK Ethereum,0.4404,0.266,0.734,0.0,1,"['VerfiedAirdrop', 'Good', 'project', 'naufalbayanaka', 'faisalabian', 'naufalfadlan', 'Clockx24', 'UTK', 'Ethereum']"
96,2022-04-14 20:50:59,RT JacobsenStamp AMAZING Terra bought another100 million Bitcoin becoming18th largest HOLDER world   And,0.6739,0.274,0.726,0.0,1,"['RT', 'JacobsenStamp', 'AMAZING', 'Terra', 'bought', 'another100', 'million', 'Bitcoin', 'becoming18th', 'largest', 'HOLDER', 'world', 'And']"
97,2022-04-14 20:50:59,ABC Look I found Salvator Mund collectible httpstcoZkg5jMIqoa rarible ethereum nonfungible digitalasset nft via rarible,0.0,0.0,1.0,0.0,0,"['ABC', 'Look', 'I', 'found', 'Salvator', 'Mund', 'collectible', 'httpstcoZkg5jMIqoa', 'rarible', 'ethereum', 'nonfungible', 'digitalasset', 'nft', 'via', 'rarible']"
98,2022-04-14 20:50:58,Name Bancorp Supply 50000000000 Symbol BAP  RULES1 FOLLOW 2 RETWEET 3 COMMENT ERC20 AIRDROP ICO BITCOIN BLOCKCHAIN TOKEN GIVEAWAY Ethereum BNB httpstco8nsWGTiFLm httpstco39r9pPMcXt,0.0,0.0,1.0,0.0,0,"['Name', 'Bancorp', 'Supply', '50000000000', 'Symbol', 'BAP', 'RULES1', 'FOLLOW', '2', 'RETWEET', '3', 'COMMENT', 'ERC20', 'AIRDROP', 'ICO', 'BITCOIN', 'BLOCKCHAIN', 'TOKEN', 'GIVEAWAY', 'Ethereum', 'BNB', 'httpstco8nsWGTiFLm', 'httpstco39r9pPMcXt']"
99,2022-04-14 20:50:57,We know btc moon crypto binance cryptocurrency bitcoin eth ethereum httpstco2k7UpqC0BI,0.0,0.0,1.0,0.0,0,"['We', 'know', 'btc', 'moon', 'crypto', 'binance', 'cryptocurrency', 'bitcoin', 'eth', 'ethereum', 'httpstco2k7UpqC0BI']"
